{
  "subject": "plugin:contact-form-7",
  "requires": ["rest:public", "jquery"],
  "notes": "Contact Form 7 submits through the public REST API and its front-end script depends on jQuery. Restricting either stops every form on the site working, with no error the visitor can act on.",
  "confidence": 0.99
}
